Sequence	BLAST	Pfam	Prosite	KEGG Pathway	Gene Ontology	Comments
ABO13143	50S ribosomal protein L27; Ribonucleoprotein; Ribosomal protein	Ribosomal L27 protein; Peptidase family M23	Ribosomal protein L27 signature	Ribosome [acb03010]	ribosome [GO:0005840]; structural constituent of ribosome [GO:0003735]; translation [GO:0006412]; structural constituent of ribosome [GO:0003735]; translation [GO:0006412]; intracellular [GO:0005622]; ribosome [GO:0005840]; structural constituent of ribosome [GO:0003735]; translation [GO:0006412]; intracellular [GO:0005622]; ribosome [GO:0005840]	NULL	likely a 50S protein tRNA subunit
ABO13145	All-trans-nonaprenyl-diphosphate synthase (geranyl-diphosphate specific); Magnesium; Metal-binding; Transferase; Ubiquinone biosynthesis	Polyprenyl synthetase; Heptaprenyl diphosphate synthase (HEPPP synthase) subunit 1; Domain of unknown function (DUF3846)	Polyprenyl synthases signature 2; Polyprenyl synthases signature 1	Biosynthesis of secondary metabolites [acb01110]; Terpenoid backbone biosynthesis [acb00900]	all-trans-nonaprenyl-diphosphate synthase (geranyl-diphosphate specific) activity [GO:0052923]; metal ion binding [GO:0046872]; trans-octaprenyltranstransferase activity [GO:0050347]; isoprenoid biosynthetic process [GO:0008299]; ubiquinone biosynthetic process [GO:0006744]; isoprenoid biosynthetic process [GO:0008299]; menaquinone biosynthetic process [GO:0009234]	NULL	
ABO13863	7-alpha-hydroxysteroid dehydrogenase; 3D-structure; Bile acid catabolism; Complete proteome; Direct protein sequencing; Lipid degradation; Lipid metabolism; NAD; Oxidoreductase; Reference proteome; Steroid metabolism	Enoyl-(Acyl carrier protein) reductase; short chain dehydrogenase; KR domain; NAD dependent epimerase/dehydratase family; 3-beta hydroxysteroid dehydrogenase/isomerase family; 3-hydroxyacyl-CoA dehydrogenase, NAD binding domain; GDP-mannose 4,6 dehydratase	Short-chain dehydrogenases/reductases family signature	Secondary bile acid biosynthesis [acb00121]	cytosol [GO:0005829]; cholate 7-alpha-dehydrogenase activity [GO:0008709]; identical protein binding [GO:0042802]; bile acid catabolic process [GO:0030573]; protein homotetramerization [GO:0051289]; catalytic activity [GO:0003824]; coenzyme binding [GO:0050662]; 3-beta-hydroxy-delta5-steroid dehydrogenase activity [GO:0003854]; oxidoreductase activity, acting on the CH-OH group of donors, NAD or NADP as acceptor [GO:0016616]; steroid biosynthetic process [GO:0006694]; oxidation-reduction process [GO:0055114]; 3-hydroxyacyl-CoA dehydrogenase activity [GO:0003857]; oxidoreductase activity [GO:0016491]; fatty acid metabolic process [GO:0006631]; oxidation-reduction process [GO:0055114]; oxidoreductase activity [GO:0016491]	NULL	Consistantly labeled a dehydrogenase, likely part of several metabolic pathways and maybe expressed in several tissue types 
ABO13860	Replication protein; DNA replication; Plasmid	Initiator Replication protein	NULL	NULL	extrachromosomal circular DNA [GO:0005727]; DNA-directed DNA polymerase activity [GO:0003887]; DNA replication initiation [GO:0006270]; DNA-directed DNA polymerase activity [GO:0003887]; DNA replication initiation [GO:0006270]; extrachromosomal circular DNA [GO:0005727]	NULL	Likely a Plasmid Replication initiator; possibly DNA Polymerase
ABO13861	Replication protein; DNA replication; Plasmid	Initiator Replication protein	Tubulin-beta mRNA autoregulation signal	NULL	extrachromosomal circular DNA [GO:0005727]; DNA-directed DNA polymerase activity [GO:0003887]; DNA replication initiation [GO:0006270]; DNA-directed DNA polymerase activity [GO:0003887]; DNA replication initiation [GO:0006270]; extrachromosomal circular DNA [GO:0005727]	NULL	Likely a Plasmid Replication initiator; possibly DNA Polymerase
ABO12791	Putative isochorismate synthase; Isomerase	chorismate binding enzyme; NPH3 family; Domain of unknown function (DUF4041)	NULL	Metabolic pathways [acb01100]; Biosynthesis of siderophore group nonribosomal peptides [acb01053]; Ubiquinone and other terpenoid-quinone biosynthesis [acb00130]; Biosynthesis of secondary metabolites [acb01110]; Biosynthesis of antibiotics [acb01130]	isochorismate synthase activity [GO:0008909]; biosynthetic process [GO:0009058]	NULL	Possible antibiotic-resistance gene
ABO12797	Probable ABC transporter ATP-binding protein HI_0664; ATP-binding; Cell inner membrane; Cell membrane; Complete proteome; Membrane; Nucleotide-binding; Reference proteome; Transmembrane; Transmembrane helix; Transport	ABC transporter transmembrane region; Interleukin 32	ABC transporter integral membrane type-1 fused domain profile	NULL	integral component of membrane [GO:0016021]; plasma membrane [GO:0005886]; ATP binding [GO:0005524]; ATPase activity, coupled to transmembrane movement of substances [GO:0042626]; ATP binding [GO:0005524]; ATPase activity, coupled to transmembrane movement of substances [GO:0042626]; transport [GO:0006810]; transmembrane transport [GO:0055085]; integral component of membrane [GO:0016021]; immune response [GO:0006955]; ATP binding [GO:0005524]; ATPase activity, coupled to transmembrane movement of substances [GO:0042626]; transport [GO:0006810]; transmembrane transport [GO:0055085]; integral component of membrane [GO:0016021]	NULL	Translocation membrane protein involved in ATP breakdown
ABO12796	Fe(3+) ions import ATP-binding protein FbpC; ATP-binding; Cell inner membrane; Cell membrane; Complete proteome; Hydrolase; Ion transport; Iron; Iron transport; Membrane; Nucleotide-binding; Transport	ABC transporter; P-loop containing region of AAA domain; RsgA GTPase; AAA domain; AAA ATPase domain; AAA domain, putative AbiEii toxin, Type IV TA system; AAA domain; AAA domain; AAA domain; AAA domain; IstB-like ATP binding protein; ATPase family associated with various cellular activities (AAA); AAA domain; CobQ/CobB/MinD/ParA nucleotide binding domain; AAA domain; CobW/HypB/UreG, nucleotide-binding domain; NACHT domain; NTPase; 50S ribosome-binding GTPase; AAA domain; AAA domain; Type II/IV secretion system protein; NB-ARC domain; ATPase domain predominantly from Archaea; PhoH-like protein; RecF/RecN/SMC N terminal domain; KaiC; Poxvirus A32 protein; SRP54-type protein, GTPase domain; AAA domain (dynein-related subfamily); Threonylcarbamoyl adenosine biosynthesis protein TsaE; Predicted ATPase of the ABC class; AAA domain; Zeta toxin	NULL	NULL	ATP-binding cassette (ABC) transporter complex [GO:0043190]; ATP binding [GO:0005524]; ferric-transporting ATPase activity [GO:0015408]; iron ion homeostasis [GO:0055072]; ATP binding [GO:0005524]; ATPase activity [GO:0016887]; GTPase activity [GO:0003924]; GTP binding [GO:0005525]; ATP binding [GO:0005524]; ATP binding [GO:0005524]; ATP binding [GO:0005524]; nucleotide phosphatase activity, acting on free nucleotides [GO:0098519]; GTP binding [GO:0005525]; ATP binding [GO:0005524]; transport [GO:0006810]; ADP binding [GO:0043531]; ATP binding [GO:0005524]; ATP binding [GO:0005524]; GTP binding [GO:0005525]; SRP-dependent cotranslational protein targeting to membrane [GO:0006614]; ATP binding [GO:0005524]; ATPase activity [GO:0016887]; tRNA threonylcarbamoyladenosine modification [GO:0002949]; ATP binding [GO:0005524]; kinase activity [GO:0016301]	NULL	Translocation membrane protein involved in ATP breakdown
ABO12795	Uncharacterized ABC transporter ATP-binding protein MJ0796; 3D-structure; ATP-binding; Complete proteome; Nucleotide-binding; Reference proteome; Transport	ABC transporter; AAA domain, putative AbiEii toxin, Type IV TA system; RecF/RecN/SMC N terminal domain; Putative exonuclease SbcCD, C subunit	ABC transporters family signature	NULL	ATP binding [GO:0005524]; ATPase activity [GO:0016887]; transport [GO:0006810]; ATP binding [GO:0005524]; ATPase activity [GO:0016887]; ATP binding [GO:0005524]; ATP binding [GO:0005524]; ATPase activity [GO:0016887]	NULL	Translocation membrane protein involved in ATP breakdown
ABO12107		NULL	NULL	NULL	NULL	NULL	NO DB HITS
ABO12102		NULL	NULL	NULL	NULL	NULL	NO DB HITS
ABO12103	Uncharacterized protein YidB; Complete proteome; Reference proteome	Bacterial protein of unknown function (DUF937)	NULL	NULL	NULL	NULL	NO DB HITS
ABO12820		NULL	NULL	NULL	NULL	NULL	NO DB HITS
ABO13138	Siroheme synthase; Cobalamin biosynthesis; Complete proteome; Lyase; Methyltransferase; Multifunctional enzyme; NAD; Oxidoreductase; Phosphoprotein; Porphyrin biosynthesis; Reference proteome; S-adenosyl-L-methionine; Transferase	Putative NAD(P)-binding	NULL	NULL	NAD binding [GO:0051287]; precorrin-2 dehydrogenase activity [GO:0043115]; sirohydrochlorin ferrochelatase activity [GO:0051266]; uroporphyrin-III C-methyltransferase activity [GO:0004851]; cobalamin biosynthetic process [GO:0009236]; siroheme biosynthetic process [GO:0019354]; precorrin-2 dehydrogenase activity [GO:0043115]; porphyrin-containing compound biosynthetic process [GO:0006779]; siroheme biosynthetic process [GO:0019354]; oxidation-reduction process [GO:0055114]	NULL	Possibly plays a role in oxidative phosphorylation
ABO13139	Serine--tRNA ligase; Aminoacyl-tRNA synthetase; ATP-binding; Cytoplasm; Ligase; Nucleotide-binding; Protein biosynthesis	tRNA synthetase class II core domain (G, H, P, S and T)	Aminoacyl-transfer RNA synthetases class-II family profile	Aminoacyl-tRNA biosynthesis [acb00970]	cytoplasm [GO:0005737]; ATP binding [GO:0005524]; serine-tRNA ligase activity [GO:0004828]; selenocysteinyl-tRNA(Sec) biosynthetic process [GO:0097056]; seryl-tRNA aminoacylation [GO:0006434]; nucleotide binding [GO:0000166]; aminoacyl-tRNA ligase activity [GO:0004812]; ATP binding [GO:0005524]; tRNA aminoacylation for protein translation [GO:0006418]	NULL	attaches amino acids to a tRNA during translation
ABO13137	Methionyl-tRNA formyltransferase; Complete proteome; Protein biosynthesis; Reference proteome; Transferase	Glutamine cyclotransferase; Type-F conjugative transfer system pilin assembly protein	NULL	NULL	methionyl-tRNA formyltransferase activity [GO:0004479]; glutaminyl-peptide cyclotransferase activity [GO:0016603]; peptidyl-pyroglutamic acid biosynthetic process, using glutaminyl-peptide cyclotransferase [GO:0017186]	NULL	likely a t-rna transferase that functions in amino acid transfer during translation
ABO12114		ChaB	NULL	NULL	NULL	NULL	NO DB HITS